{
  "agent_provider_id": "codex_cli",
  "confidence": 0.88,
  "findings": [],
  "generated_at_utc": "2026-03-05T00:00:00Z",
  "instruction_scope_refs": [
    "docs/contracts/FORMALIZATION_GOVERNANCE_CONTRACT.md"
  ],
  "resolved_invocation_signature": "codex exec review",
  "review_closeout": {
    "evidence_refs": [
      "artifacts/review/skip_note.md"
    ],
    "mode": "REVIEW_SKIPPED",
    "skip_reason_code": "NO_EFFECTIVE_CHANGE"
  },
  "review_history_consistency": {
    "contradiction_count": 0,
    "contradiction_refs": [],
    "nitpick_refs": [],
    "potential_nitpick_count": 0
  },
  "scope_ref": "docs/contracts/FORMALIZATION_GOVERNANCE_CONTRACT.md",
  "verdict": "PASS",
  "version": "0.1"
}
